{
  "task_id": "task-153169AE",
  "created_at": "2026-04-15T19:13:36Z",
  "updated_at": "2026-04-15T19:20:00Z",
  "status": "failed",
  "request": "Update the planner so that ALL run_command steps must be real executable commands. Specifically, remove any placeholder verification steps like 'command to generate a new plan'. If verification is needed, replace it with a real command (e.g., run the planner via its CLI or a Python entry point). If no valid command exists, skip the verification step instead of generating a placeholder.",
  "title": "Update planner to use real executable commands",
  "goals": [
    "Identify all run_command steps in the planner that use placeholder verification steps",
    "Replace placeholder verification steps with real executable commands",
    "Remove any verification steps that cannot be replaced with a real command"
  ],
  "constraints": [
    "Do not generate any placeholder commands",
    "Ensure all commands are executable via CLI or Python entry point"
  ],
  "success_criteria": [
    "All run_command steps in the planner use real executable commands",
    "No placeholder verification steps remain in the planner",
    "Verification steps that cannot be replaced are removed"
  ],
  "tags": [
    "refactor",
    "automation",
    "planner"
  ],
  "priority": "high",
  "revision_count": 4,
  "max_revisions": 3,
  "branch_name": "task/task-153169AE/update-planner-to-use-real-executable-commands",
  "pr_url": "",
  "failure_reason": "Exceeded max revisions (3)"
}