{
  "task_id": "task-49D6EBCC",
  "created_at": "2026-04-15T14:49:01Z",
  "updated_at": "2026-04-15T14:54:50Z",
  "status": "failed",
  "request": "Update the planner so that ALL test commands use 'python -m pytest' instead of 'pytest'. Also enforce that dependency installation steps use 'python -m pip install <package>' instead of bare 'pip install'. This must apply to all generated plans to ensure compatibility with the executor environment.",
  "title": "Update planner for Python command compatibility",
  "goals": [
    "Modify all test commands in the planner to use 'python -m pytest'",
    "Change all dependency installation steps in the planner to use 'python -m pip install <package>'",
    "Ensure all generated plans reflect these command changes for compatibility"
  ],
  "constraints": [
    "Do not alter any non-Python related commands",
    "Ensure changes do not affect the functionality of existing plans"
  ],
  "success_criteria": [
    "All test commands in the planner use 'python -m pytest'",
    "All dependency installation steps use 'python -m pip install <package>'",
    "Generated plans are verified to work in the executor environment with these changes"
  ],
  "tags": [
    "planner",
    "compatibility",
    "python",
    "refactor"
  ],
  "priority": "high",
  "revision_count": 4,
  "max_revisions": 3,
  "branch_name": "task/task-49D6EBCC/update-planner-for-python-command-compatibility",
  "pr_url": "",
  "failure_reason": "Exceeded max revisions (3)"
}