{
  "task_id": "task-7E7461D5",
  "created_at": "2026-04-15T11:37:22Z",
  "updated_at": "2026-04-15T11:39:20Z",
  "status": "complete",
  "request": "Critically review the current README.md and identify weaknesses, gaps, unclear areas, and missing sections. Then improve it to be production-grade documentation with clear differentiation, limitations, and real-world usage clarity.",
  "title": "Review and enhance README.md for production-grade quality",
  "goals": [
    "Identify weaknesses, gaps, and unclear areas in the current README.md",
    "Determine missing sections that are essential for production-grade documentation",
    "Improve the README.md to include clear differentiation, limitations, and real-world usage clarity"
  ],
  "constraints": [
    "Do not remove any existing sections unless they are redundant or incorrect",
    "Ensure the README.md remains under 2000 words"
  ],
  "success_criteria": [
    "All identified weaknesses, gaps, and unclear areas are addressed",
    "All essential sections for production-grade documentation are present",
    "The README.md clearly differentiates the project, outlines its limitations, and provides real-world usage clarity"
  ],
  "tags": [
    "documentation",
    "review",
    "improvement"
  ],
  "priority": "high",
  "revision_count": 0,
  "max_revisions": 3,
  "branch_name": "task/task-7E7461D5/review-and-enhance-readme-md-for-production-grade-",
  "pr_url": ""
}