{
  "task_id": "task-1F56C8CA",
  "created_at": "2026-04-15T11:30:14Z",
  "updated_at": "2026-04-15T11:33:28Z",
  "status": "complete",
  "request": "Improve the README that was just generated. Make it clearer, more structured, and production-quality.",
  "title": "Enhance the clarity and structure of the README",
  "goals": [
    "Revise the README to improve clarity and readability",
    "Organize the README content into a logical, structured format",
    "Ensure the README meets production-quality standards"
  ],
  "constraints": [
    "Do not remove any existing sections unless redundant",
    "Maintain the original intent and information of the README"
  ],
  "success_criteria": [
    "The README is clearly understandable by a new user",
    "The README follows a logical structure with appropriate headings",
    "The README is free of grammatical and spelling errors"
  ],
  "tags": [
    "documentation",
    "quality",
    "readability"
  ],
  "priority": "high",
  "revision_count": 0,
  "max_revisions": 3,
  "branch_name": "task/task-1F56C8CA/enhance-the-clarity-and-structure-of-the-readme",
  "pr_url": ""
}